ASIGNATURA;UNIDAD;FECHA;CANTPREG;PREGUNTA;TEMA;TIPOPREGUNTA;RESPUESTACORRECTA;CANTALT;ALTERNATIVAS;ALTCORRECTA;CANTNOTAS;NOTA;ALUMNO
Matematicas;Limites;12-06-2022;3;¿Cómo se define el límite lateral derecho de una función en un punto específico?;Limites Laterales;alt;4;El límite de la función a medida que la variable se aproxima a ese punto desde valores menores a dicho punto.;El límite de la función a medida que la variable se aproxima a ese punto desde valores mayores a dicho punto.;El límite de la función a medida que la variable se aproxima a ese punto desde ambos lados, pero sin incluir el punto.;El límite de la función a medida que la variable se aproxima a ese punto desde ambos lados, incluyendo el punto.;b;¿Qué condiciones deben cumplirse para que una función tenga límite lateral derecho en un punto?;Limites Laterales;alt;4;La función debe ser continua en ese punto.;La función debe ser derivable en ese punto.;La función debe estar definida en ese punto.;La función debe ser acotada en ese punto.;c; ¿Qué representa el límite de una función en un punto específico?;Límites en Cálculo;des;El límite de una función en un punto representa hacia dónde tiende la función a medida que la variable se acerca a ese punto.;3;3.0;Alex;4.4;Javier;5.7;Roberto;
Lenguaje;Análisis del Lenguaje;12-06-2022;5;Escribe un poema relacionado con la naturaleza.;Poesía;des;Escribe aquí tu poema sobre la naturaleza.;Identifica la parte de la oración que contiene el verbo.;Gramática;alt;4;Sujeto;Predicado;Complemento directo;Complemento indirecto;b;Escribe una carta formal.;Redacción;des;Escribe aquí tu carta formal.;Identifica la sílaba con acento en la palabra 'rápido'.;Ortografía;alt;4;Sílaba tónica;Sílaba átona;Sílaba trabada;Diptongo;a;Explica qué es una metáfora.;Figuras Literarias;des;Escribe aquí tu definición de metáfora.;5;6.7;Sergio;5.8;Juan;5.9;Carlos;2.2;Alberto;6.1;Nomura;
Historia;Evolución de la Sociedad;12-06-2022;5;Describe la Revolución Industrial y su impacto en la sociedad.;Historia Moderna;des;La Revolución Industrial fue un período de transformación económica y social que comenzó en Gran Bretaña a finales del siglo XVIII.;¿Quién fue el líder durante las Guerras Napoleónicas?;Historia Contemporánea;alt;4;Napoleón Bonaparte;George Washington;Simón Bolívar;Winston Churchill;a;Explica qué fue la Guerra Fría.;Historia Contemporánea;des;Escribe aquí tu explicación de la Guerra Fría.;¿La Revolución Rusa de 1917 estableció un gobierno comunista?;Revolución Rusa;alt;2;Sí;No;a;Habla sobre el imperio romano.;Historia Antigua;des;Escribe aquí sobre el imperio romano.;5;7.0;Federico;3.5;Pedro;6.6;Axel;4.1;Estudiante4;4.9;Álvaro;
Ciencias;Biología, Química y Física;12-06-2022;5;Explica el ciclo del agua.;Biología;des;El ciclo del agua, también conocido como ciclo hidrológico, es el proceso de circulación del agua en la atmósfera y en la tierra.;¿Cuál es el estado de la materia con forma y volumen definidos?;Física;alt;4;Sólido;Líquido;Gas;Plasma;b;Explica la teoría de la relatividad de Einstein.;Física Moderna;des;La teoría de la relatividad propuesta por Albert Einstein revolucionó nuestra comprensión del espacio, el tiempo y la gravedad.;¿Cuál es la molécula que contiene la información genética en las células?;Genética;alt;4;ADN;ARN;ARNt;ARNm;a;Explica la ley de la conservación de la energía.;Física;des;La ley de la conservación de la energía establece que la energía no se crea ni se destruye, solo se transforma.;5;8.0;Kevin;3.5;Juana;5.2;Fernanda;5.7;Francisca;7.0;Rubén;
Inglés;Vocabulary;12-06-2022;5;Describe tu rutina diaria en inglés.;Vocabulario y Rutinas;des;Write about your daily routine using English.;What is the capital of England?;Geography;alt;4;London;Paris;Madrid;Rome;a;Explique el uso del presente continuo en inglés.;Gramática;des;Explain the use of present continuous tense in English.;What color is the grass?;Colors;alt;4;Red;Blue;Green;Yellow;c;Habla sobre tus vacaciones ideales en inglés.;Vocabulario y Viajes;des;Talk about your ideal vacation using English.;5;6.6;Yerko;6.2;Manolo;6.9;Tamara;4.0;Ignacia;6.3;Lamar;
